{
  "schema": "atb-authority-relation-vector/0.1",
  "vector_id": "AR-007-RELATIONSHIP-MISMATCH",
  "title": "Independent authority mislabeled as delegation",
  "description": "Both authority paths are valid, but the request claims delegation even though no authority moved from A to B.",
  "observed": {
    "requester": "agent-a",
    "actor": "agent-b",
    "requested_action": {"resource": "documents", "action": "archive", "target": "doc:123"},
    "claimed_relation": "DELEGATED",
    "request_authority": {"status": "VALID", "source": "workflow-policy-h", "subject": "agent-a", "kind": "REQUEST", "action": {"resource": "documents", "action": "archive", "target": "doc:123"}, "independently_issued": true},
    "execution_authority": {"status": "VALID", "source": "resource-admin-c", "subject": "agent-b", "kind": "EXECUTION", "action": {"resource": "documents", "action": "archive", "target": "doc:123"}, "independently_issued": true},
    "delegation": {"status": "MISSING", "authority_source": null, "delegator": null, "delegatee": null, "action": {"resource": "documents", "action": "archive", "target": "doc:123"}, "attenuated": false}
  },
  "expected": {"schema": "atb-authority-relation-output/0.1", "status": "DECIDED", "vector_id": "AR-007-RELATIONSHIP-MISMATCH", "requester": "agent-a", "actor": "agent-b", "request_authority_source": "workflow-policy-h", "request_authority_valid": true, "execution_authority_source": "resource-admin-c", "immediate_authority_grantor": "resource-admin-c", "execution_authority_valid": true, "authority_relation": "INVALID", "authorized": false, "reason": "RELATIONSHIP_MISMATCH"}
}
