{
  "schema": "atb-authority-relation-vector/0.1",
  "vector_id": "AR-004-UNAUTHORIZED-EXECUTOR",
  "title": "Request authority cannot manufacture execution authority",
  "description": "A may request the action, but B lacks authority to execute it.",
  "observed": {
    "requester": "agent-a",
    "actor": "agent-b",
    "requested_action": {"resource": "documents", "action": "archive", "target": "doc:123"},
    "claimed_relation": "INDEPENDENT",
    "request_authority": {"status": "VALID", "source": "workflow-policy-h", "subject": "agent-a", "kind": "REQUEST", "action": {"resource": "documents", "action": "archive", "target": "doc:123"}, "independently_issued": true},
    "execution_authority": {"status": "INVALID", "source": "resource-admin-c", "subject": "agent-b", "kind": "EXECUTION", "action": {"resource": "documents", "action": "archive", "target": "doc:123"}, "independently_issued": true},
    "delegation": {"status": "MISSING", "authority_source": null, "delegator": null, "delegatee": null, "action": {"resource": "documents", "action": "archive", "target": "doc:123"}, "attenuated": false}
  },
  "expected": {"schema": "atb-authority-relation-output/0.1", "status": "DECIDED", "vector_id": "AR-004-UNAUTHORIZED-EXECUTOR", "requester": "agent-a", "actor": "agent-b", "request_authority_source": "workflow-policy-h", "request_authority_valid": true, "execution_authority_source": null, "immediate_authority_grantor": null, "execution_authority_valid": false, "authority_relation": "NONE", "authorized": false, "reason": "EXECUTION_AUTHORITY_INVALID"}
}
